pink flowers with white background	[{'url': 'https://images.unsplash.com/photo-1602934585418-f588bea4215c?q=80&w=2080&auto=format&fit=crop&ixlib=rb-4.0.3&ixid=M3wxMjA3fDB8MHxwaG90by1wYWdlfHx8fGVufDB8fHx8fA%3D%3D', 'path': 'full/db89b1e0019bfb660c7d50d5400cd18b0948ef80.jpg', 'checksum': '0a608bd3a1eb517e2a03cc88a972c0ee', 'status': 'downloaded'}]	Download this free HD photo of flower, spring, nature, and 壱岐市 長崎県 日本 in 壱岐市, 日本 by TOMOKO UJI (@ujitomo)	2020-10-17 11:37:32
assorted flowers	[{'url': 'https://images.unsplash.com/photo-1518943701174-17e4aff936d4?q=80&w=3456&auto=format&fit=crop&ixlib=rb-4.0.3&ixid=M3wxMjA3fDB8MHxwaG90by1wYWdlfHx8fGVufDB8fHx8fA%3D%3D', 'path': 'full/b801b1b68da7e024626b12057e5fb68dac7a9c32.jpg', 'checksum': '85c249864bf3dce5847ec7407345c01c', 'status': 'downloaded'}]	Download this free HD photo of flower, spring, tulip, and petal by Anton Darius (@thesollers)	2018-02-18 08:48:34
a bouquet of red tulips on a purple background	[{'url': 'https://plus.unsplash.com/premium_photo-1676400614009-3b230ef8be6d?q=80&w=3410&auto=format&fit=crop&ixlib=rb-4.0.3&ixid=M3wxMjA3fDB8MHxwaG90by1wYWdlfHx8fGVufDB8fHx8fA%3D%3D', 'path': 'full/2d0304f185b2848786e58fbd3d7f20a7d3dcac58.jpg', 'checksum': '82d98c08b840708d221a90e3cf920342', 'status': 'downloaded'}]	Download this HD photo of flowers, tulip, flowers wallpaper, and spring by Lala Azizli (@lazizli)	2023-02-15 09:16:09
pink and white flowers under white sky during daytime	[{'url': 'https://images.unsplash.com/photo-1602615576820-ea14cf3e476a?q=80&w=5472&auto=format&fit=crop&ixlib=rb-4.0.3&ixid=M3wxMjA3fDB8MHxwaG90by1wYWdlfHx8fGVufDB8fHx8fA%3D%3D', 'path': 'full/0b521e8ce2c27cc5523ad40090c31256189d63bb.jpg', 'checksum': '12bee15b82288c6ddb862b73b3a6906d', 'status': 'downloaded'}]	Download this free HD photo of flower, pink, spring, and nature in 壱岐市, 日本 by TOMOKO UJI (@ujitomo)	2020-10-13 18:59:58
a person holding a potted plant in their hands	[{'url': 'https://plus.unsplash.com/premium_photo-1679590626149-7c31860ad2b1?q=80&w=3444&auto=format&fit=crop&ixlib=rb-4.0.3&ixid=M3wxMjA3fDB8MHxwaG90by1wYWdlfHx8fGVufDB8fHx8fA%3D%3D', 'path': 'full/d52e89d57fd70addba6be815087dbf859f1ee6a3.jpg', 'checksum': '7cd4bac67cd565391a21fdf7a7f92f2a', 'status': 'downloaded'}]	Download this HD photo of spring, garden, gardening, and horticulture by Ave Calvar (@3tnik)	2023-03-24 10:03:47
pink flowers in tilt shift lens	[{'url': 'https://images.unsplash.com/photo-1600647993560-11a92e039466?q=80&w=3712&auto=format&fit=crop&ixlib=rb-4.0.3&ixid=M3wxMjA3fDB8MHxwaG90by1wYWdlfHx8fGVufDB8fHx8fA%3D%3D', 'path': 'full/5aba4a9fdf8686220a52349a2048f9d137c42e15.jpg', 'checksum': 'c2158c25440f363946c8ff0d0518a69a', 'status': 'downloaded'}]	Pink cosmos flowers	2020-09-21 00:29:40
low angle photo of cherry blossoms tree	[{'url': 'https://images.unsplash.com/photo-1462275646964-a0e3386b89fa?q=80&w=4896&auto=format&fit=crop&ixlib=rb-4.0.3&ixid=M3wxMjA3fDB8MHxwaG90by1wYWdlfHx8fGVufDB8fHx8fA%3D%3D', 'path': 'full/52c30b72a40a347186e2f12d04427d19621be1ec.jpg', 'checksum': '8620f718be23c2182bc4a21e49e26ccb', 'status': 'downloaded'}]	Kungsträdgården cherry blossom Love the work? buy me a coffee ☕ PayPal - a.smit@mac.com	2016-05-03 11:41:32
green grass field sunset scenery	[{'url': 'https://images.unsplash.com/photo-1560258018-c7db7645254e?q=80&w=4032&auto=format&fit=crop&ixlib=rb-4.0.3&ixid=M3wxMjA3fDB8MHxwaG90by1wYWdlfHx8fGVufDB8fHx8fA%3D%3D', 'path': 'full/d73745d953067ee0b07cdbfa03fdbdcd66142169.jpg', 'checksum': 'b18a9c98083470bfa94cd8c81c343bb8', 'status': 'downloaded'}]	Download this free HD photo of nature, garden, warm, and sun by Aniket Bhattacharya (@aniket940518)	2019-06-11 13:01:48
selective focus photography of pink petaled flower	[{'url': 'https://images.unsplash.com/photo-1522748906645-95d8adfd52c7?q=80&w=3425&auto=format&fit=crop&ixlib=rb-4.0.3&ixid=M3wxMjA3fDB8MHxwaG90by1wYWdlfHx8fGVufDB8fHx8fA%3D%3D', 'path': 'full/b0468480e16a8333c7ecbcce48ffc78bb1ff3739.jpg', 'checksum': '199b7b94a06b2a4692eb82217e0747d6', 'status': 'downloaded'}]	sakura	2018-04-03 09:51:01
a box of water next to a bunch of flowers	[{'url': 'https://images.unsplash.com/photo-1679678691328-54929d271c3f?q=80&w=6016&auto=format&fit=crop&ixlib=rb-4.0.3&ixid=M3wxMjA3fDB8MHxwaG90by1wYWdlfHx8fGVufDB8fHx8fA%3D%3D', 'path': 'full/faa238469e9565ce3f8f7315fb0f432d3563de22.jpg', 'checksum': '6cd3f28b645403db4c20a1b6ec224d64', 'status': 'downloaded'}]	Download this free HD photo of petal, flower, leaf, and text by Boxed Water Is Better (@boxedwater)	2023-03-24 17:27:15
close shot of yellow flowers	[{'url': 'https://images.unsplash.com/photo-1523766775147-152d0d6e2adb?q=80&w=4016&auto=format&fit=crop&ixlib=rb-4.0.3&ixid=M3wxMjA3fDB8MHxwaG90by1wYWdlfHx8fGVufDB8fHx8fA%3D%3D', 'path': 'full/ce020a06c11e5d75cedd509cfe522dc6c1f22433.jpg', 'checksum': '003bbc509ee5ff94734955bcf437da74', 'status': 'downloaded'}]	Download this free HD photo of flower, spring, nature, and wallpaper in Shibuya-ku, Japan by Masaaki Komori (@gaspanik)	2018-04-15 04:33:42
white flowers under blue sky during daytime	[{'url': 'https://images.unsplash.com/photo-1586952205040-22514ffab1a1?q=80&w=3098&auto=format&fit=crop&ixlib=rb-4.0.3&ixid=M3wxMjA3fDB8MHxwaG90by1wYWdlfHx8fGVufDB8fHx8fA%3D%3D', 'path': 'full/416a51cd184e94bb79482bfaa1449321043a33f1.jpg', 'checksum': '08b54486189b58b5bf7ecb0e48e38cc2', 'status': 'downloaded'}]	"Peach Tree Blooms In Sunny Sky. 🍑
Spring In Kashmir."	2020-04-15 12:08:55
white flowers in shallow focus photography	[{'url': 'https://images.unsplash.com/photo-1503919483171-9ffc1debc390?q=80&w=5472&auto=format&fit=crop&ixlib=rb-4.0.3&ixid=M3wxMjA3fDB8MHxwaG90by1wYWdlfHx8fGVufDB8fHx8fA%3D%3D', 'path': 'full/df4d934fd8db67fdf8ab28145f23c0fc84611ceb.jpg', 'checksum': 'd73eb83492e349e120a7e3607193df63', 'status': 'downloaded'}]	Yellow flowers white petals	2017-08-28 11:25:04
a man and a woman laying on a blanket with fruit	[{'url': 'https://images.unsplash.com/photo-1696446701434-93e3f91dac2b?q=80&w=6048&auto=format&fit=crop&ixlib=rb-4.0.3&ixid=M3wxMjA3fDB8MHxwaG90by1wYWdlfHx8fGVufDB8fHx8fA%3D%3D', 'path': 'full/558e7eee04f5ac8b978ca9e377e4a0f01ef5fe05.jpg', 'checksum': 'bf70f8974f41a255b6a3097d3bc823bf', 'status': 'downloaded'}]	Download this free HD photo of brunch, food, adult, and man by Boxed Water Is Better (@boxedwater)	2023-10-04 19:16:46
aerial photography of flowers at daytime	[{'url': 'https://images.unsplash.com/photo-1470240731273-7821a6eeb6bd?q=80&w=5745&auto=format&fit=crop&ixlib=rb-4.0.3&ixid=M3wxMjA3fDB8MHxwaG90by1wYWdlfHx8fGVufDB8fHx8fA%3D%3D', 'path': 'full/b5cade1602c9998ceebe25ef4a86e5a8ee8b007f.jpg', 'checksum': 'e5c6ebc2485a2eb1f1ae805ef79a1503', 'status': 'downloaded'}]	Download this free HD photo of wildflower, explore, summer, and flower filed in Red Cliff, United States by Joel Holland (@joelholland)	2016-08-03 16:14:29
orange petaled flowers	[{'url': 'https://images.unsplash.com/photo-1490750967868-88aa4486c946?q=80&w=7952&auto=format&fit=crop&ixlib=rb-4.0.3&ixid=M3wxMjA3fDB8MHxwaG90by1wYWdlfHx8fGVufDB8fHx8fA%3D%3D', 'path': 'full/dc0a70b0054dbfaec7fd0d9db353799dda7e9978.jpg', 'checksum': '4e7b5787281f725b22e40fdf04202d26', 'status': 'downloaded'}]	California blooming like crazy after months of non-stop rains. Even deserts are covered with juicy bright flowers. The photo was made on Diamond Valley Lake a few days ago.	2017-03-29 01:32:47
a woman is holding a potted plant on a table	[{'url': 'https://plus.unsplash.com/premium_photo-1679516403332-ba697d77ab8a?q=80&w=5734&auto=format&fit=crop&ixlib=rb-4.0.3&ixid=M3wxMjA3fDB8MHxwaG90by1wYWdlfHx8fGVufDB8fHx8fA%3D%3D', 'path': 'full/5588d44a314c8d0f7a16034bd2e9044aa5536c8e.jpg', 'checksum': '51d0dcf4d77b0d396259363549ac357f', 'status': 'downloaded'}]	Download this HD photo of spring, garden, horticulture, and gardening by Daiga Ellaby (@daiga_ellaby)	2023-03-24 10:03:08
a woman smelling a flower in a garden	[{'url': 'https://plus.unsplash.com/premium_photo-1680282558137-7c627eeefc91?q=80&w=5574&auto=format&fit=crop&ixlib=rb-4.0.3&ixid=M3wxMjA3fDB8MHxwaG90by1wYWdlfHx8fGVufDB8fHx8fA%3D%3D', 'path': 'full/b8ec0ebc7baf1f462f09c9426a1800296f0a43ba.jpg', 'checksum': '38f45a5b0a406ee5ec9bc0361461af7c', 'status': 'downloaded'}]	Download this HD photo of gardens, home garden, daffodils, and harden by Nadia Clabassi (@foifezza)	2023-04-04 11:03:20
a variety of food is laid out on a picnic blanket	[{'url': 'https://images.unsplash.com/photo-1679679008477-eeb6d3480167?q=80&w=4032&auto=format&fit=crop&ixlib=rb-4.0.3&ixid=M3wxMjA3fDB8MHxwaG90by1wYWdlfHx8fGVufDB8fHx8fA%3D%3D', 'path': 'full/8c2aac1b8d075135d6f30802c6ce1296bf601f6e.jpg', 'checksum': '9ad11fedd0b114d9f609d63f1313b03a', 'status': 'downloaded'}]	Download this free HD photo of meal, lunch, food, and bread by Boxed Water Is Better (@boxedwater)	2023-03-24 17:30:19
a view of a mountain with yellow flowers in the foreground	[{'url': 'https://plus.unsplash.com/premium_photo-1674917070243-905c3bbf1576?q=80&w=7148&auto=format&fit=crop&ixlib=rb-4.0.3&ixid=M3wxMjA3fDB8MHxwaG90by1wYWdlfHx8fGVufDB8fHx8fA%3D%3D', 'path': 'full/dcbec501b595fa3955a358232506d479e546b12f.jpg', 'checksum': 'e8407c4177b300b6c56d521a6efc5b34', 'status': 'downloaded'}]	Flowers in the mountains.	2023-01-29 06:06:09
